<?xml version="1.0" encoding="utf-8"?>

<personer xmlns="http://home.hvl.no/databaser" xmlns:xs="http://www.w3.org/2001/XMLSchema-instance"
          xs:schemaLocation="http://home.hvl.no/databaser personer.xsd">
    <person>
        <pnr>1</pnr>
        <fornavn>Ola</fornavn>
        <etternavn>Nordmann</etternavn>
        <fodselsdato>1980-01-01</fodselsdato>
    </person>
    <person>
        <pnr>2</pnr>
        <fornavn>Kari</fornavn>
        <etternavn>Pettersen</etternavn>
        <fodselsdato>1993-08-23</fodselsdato>
    </person>
</personer>
